{
  "version": "udon.execution-report.v5",
  "run_id": "fixture-attempt-1",
  "workflow_id": "fixture",
  "workflow_digest": "sha256:aaaaaaaaaaaaaaaaaaaaaaaaaaaaaaaaaaaaaaaaaaaaaaaaaaaaaaaaaaaaaaaa",
  "inventory_complete": true,
  "status": "success",
  "started_at": "2026-09-30T00:00:00Z",
  "steps": [
    {
      "step_id": "read",
      "operation_id": "get",
      "invocation_id": "read",
      "outcome": "succeeded",
      "started_at": "2026-09-30T00:00:01Z",
      "finished_at": "2026-09-30T00:00:02Z"
    },
    {
      "step_id": "write",
      "operation_id": "post",
      "invocation_id": "write",
      "outcome": "succeeded",
      "started_at": "2026-09-30T00:00:03Z",
      "finished_at": "2026-09-30T00:00:04Z"
    }
  ],
  "finished_at": "2026-09-30T00:00:05Z"
}
